{"capabilities": ["single_rally_import", "existing_output_transport"], "limitations": ["imported_existing_stage3_track", "imported_manual_stage4_events", "external_source_video", "surface_metadata_unavailable", "single_rally_import_read_only", "no_inference"], "processing_profile": "STANDARD", "schema_version": "session.v1", "session_id": "nivel_a2_01", "source_video": {"display_name": "source.mp4", "sha256": "e2a05a8eda9be4d821ae1acc60355c7c0403e450ac0febd6bb3c6a62e0aa5774"}, "status": "partial", "surface": "unknown"}
